{
  "$schema": "https://json-schema.org/draft/2020-12/schema",
  "$id": "crea-zik/archive-descriptor/v1",
  "title": "Descripteur d'archive musicale",
  "type": "object",
  "additionalProperties": false,
  "required": [
    "schema_version",
    "piece_id",
    "title",
    "version",
    "created_at",
    "parent_version",
    "status",
    "summary",
    "inspiration",
    "technical",
    "files"
  ],
  "properties": {
    "schema_version": {"const": 1},
    "piece_id": {"type": "string", "pattern": "^[a-z0-9]+(?:-[a-z0-9]+)*$"},
    "title": {"type": "string", "minLength": 1},
    "version": {"type": "string", "pattern": "^v[0-9]{3}$"},
    "created_at": {"type": "string", "format": "date"},
    "parent_version": {"type": ["string", "null"], "pattern": "^v[0-9]{3}$"},
    "status": {"enum": ["prototype", "candidate", "validated", "rejected"]},
    "summary": {"type": "string", "minLength": 1},
    "inspiration": {
      "type": "object",
      "additionalProperties": false,
      "required": ["request", "translation", "constraints"],
      "properties": {
        "request": {"type": "string"},
        "translation": {"type": "string"},
        "constraints": {"type": "array", "items": {"type": "string"}}
      }
    },
    "technical": {"type": "object"},
    "files": {
      "type": "array",
      "minItems": 1,
      "items": {
        "type": "object",
        "additionalProperties": false,
        "required": ["path", "role", "description"],
        "properties": {
          "path": {"type": "string", "minLength": 1},
          "role": {"type": "string", "pattern": "^[a-z][a-z0-9_]*$"},
          "description": {"type": "string", "minLength": 1}
        }
      }
    }
  }
}
